{
  "$schema": "../../schemas/exclusions.schema.json",
  "schema": "decision-archaeology.exclusions@v0",
  "case_id": "barite-bid-rigging-2025",
  "authority": "recorded-absence-only",
  "exclusions": [
    {
      "id": "EX-001",
      "kind": "not-located",
      "subject": "The complete text and evidentiary annexes of AMCU decision 535-р",
      "statement": "This case reconstructs the published administrative outcome, not the authority's full reasoning.",
      "search_boundary": "The official public sources inventoried on 2026-08-21: the AMCU news items, the decision register entry, and the two Prozorro API records.",
      "would_resolve": "Publication of the decision text in the official register, or a lawful access request that returns it."
    },
    {
      "id": "EX-002",
      "kind": "deliberately-minimized",
      "subject": "The complete Prozorro API responses and bid documents",
      "statement": "The committed fixture is a data-minimized projection of the two official records.",
      "minimization_basis": "SHA-256 digests of the complete responses are recorded in sources/source-index.json; the responses and bid documents themselves are not republished here."
    },
    {
      "id": "EX-003",
      "kind": "non-probative",
      "subject": "Public participation, price, and document metadata",
      "statement": "None of it independently proves coordination, intent, guilt, or legal liability."
    },
    {
      "id": "EX-004",
      "kind": "method-limited",
      "subject": "The PDF metadata audit",
      "statement": "An exploratory null result is evidence about what the method examined, and about nothing else.",
      "method": "Exploratory metadata scan over 59 public PDFs, returning no shared-authorship signal.",
      "not_examined": [
        "archives and their revision history",
        "digital signatures",
        "deleted document revisions",
        "network logs",
        "banking data",
        "evidence held by AMCU"
      ]
    },
    {
      "id": "EX-005",
      "kind": "deliberately-minimized",
      "subject": "Personal and contact data in the source records",
      "statement": "Company names and identifiers are retained; unnecessary personal and contact data are not.",
      "minimization_basis": "The identifiers are necessary to bind the official decision to the public tender records; nothing beyond that necessity was carried into the committed projection."
    },
    {
      "id": "EX-006",
      "kind": "out-of-scope",
      "subject": "Appeals, judicial review, enforcement, payment of fines, and later record changes",
      "statement": "All of it falls outside the frozen acquisition snapshot this case reasons over."
    },
    {
      "id": "EX-007",
      "kind": "access-restricted",
      "subject": "Automated re-acquisition of the AMCU pages",
      "statement": "The publisher returns HTTP 403 to automated clients, so this case cannot re-read its own decisive sources mechanically; two of the three pages are held in no independent copy.",
      "restriction_basis": "Practical restriction by the publisher's bot protection, recorded per source in sources/acquisition-state.json. It is a fact about this client, not evidence that anything was withheld.",
      "would_resolve": "An independent archival capture of the two unwitnessed pages, or a channel the publisher serves to automated readers."
    }
  ]
}
